{
  "displayName": "7-Zip",
  "description": "Application Description",
  "publisher": "Publisher",
  "appVersion": "26.00.00",
  "informationUrl": "http://localhost:5173/",
  "isFeatured": false,
  "privacyInformationUrl": "http://localhost:5173/",
  "notes": "Managed by SPA pipeline.",
  "owner": "EUC Packaging",
  "developer": "Igor Pavlov",
  "installCommandLine": "Invoke-AppDeployToolkit.exe -DeployMode Silent",
  "uninstallCommandLine": "Invoke-AppDeployToolkit.exe -DeploymentType Uninstall -DeployMode Silent",
  "applicableArchitectures": "x64",
  "minimumSupportedWindowsRelease": "Windows11_22H2",
  "displayVersion": "26.00.00",
  "allowAvailableUninstall": true,
  "installContext": "system",
  "restartBehavior": "basedOnReturnCode",
  "returnCodes": [
    {
      "returnCode": 0,
      "type": "success"
    },
    {
      "returnCode": 1707,
      "type": "success"
    },
    {
      "returnCode": 3010,
      "type": "softReboot"
    },
    {
      "returnCode": 1641,
      "type": "hardReboot"
    },
    {
      "returnCode": 1618,
      "type": "retry"
    },
    {
      "returnCode": 1111,
      "type": "success"
    }
  ]
}